{
 "schema": "scene/0.2",
 "id": "sc_q1_hoe_offer",
 "title": "The lost hoe (offer)",
 "realm": 1,
 "zone": "meadow",
 "density": "D1",
 "trigger": {
  "graph": "realm_1",
  "node": "m_farm",
  "on": "questOffer",
  "cond": {
   "not": {
    "questActive": "q1_hoe"
   }
  }
 },
 "background": "bg_farm",
 "music": "village_theme",
 "once": false,
 "slots": {
  "L1": {
   "char": "hero",
   "expr": "neutral"
  },
  "L2": {
   "char": "xiaolong",
   "expr": "neutral"
  },
  "R1": {
   "char": "farmer_li",
   "expr": "worried"
  }
 },
 "words": [
  "C037",
  "C007"
 ],
 "lines": [
  {
   "id": "l1",
   "speaker": "farmer_li",
   "side": "R1",
   "expr": "surprised",
   "en": "Oh! Hello there, little hero. And... is that a dragon?",
   "vo": null
  },
  {
   "id": "l2",
   "speaker": "farmer_li",
   "side": "R1",
   "expr": "worried",
   "en": "My hoe is gone! I put it down, the fog rolled in, and now... {C037}?",
   "tokens": [
    "C037"
   ],
   "vo": null
  },
  {
   "id": "l3",
   "speaker": "xiaolong",
   "side": "L2",
   "expr": "thinking",
   "en": "(He sniffs the air and points toward the old well.)",
   "vo": null
  },
  {
   "id": "l4",
   "speaker": "farmer_li",
   "side": "R1",
   "expr": "neutral",
   "en": "Will you look for it? I'll pay you, of course.",
   "vo": null,
   "choices": [
    {
     "id": "c1",
     "en": "Yes, I'll find it!",
     "goto": "l5",
     "setFlags": [
      "accept_q1_hoe"
     ]
    },
    {
     "id": "c2",
     "en": "Not now.",
     "goto": "l6"
    }
   ]
  },
  {
   "id": "l5",
   "speaker": "farmer_li",
   "side": "R1",
   "expr": "happy",
   "en": "{C007}! Bring it back here when you find it.",
   "tokens": [
    "C007"
   ],
   "vo": null,
   "end": true
  },
  {
   "id": "l6",
   "speaker": "farmer_li",
   "side": "R1",
   "expr": "sad",
   "en": "All right. I'll be right here, worrying.",
   "vo": null,
   "end": true
  }
 ],
 "onEnd": [
  {
   "if": {
    "flag": "accept_q1_hoe"
   },
   "acceptQuest": "q1_hoe"
  }
 ]
}