{"schema":"scene/0.2","id":"sc_r1_opening","title":"A birthday egg","realm":1,"zone":"meadow","density":"D1","trigger":{"graph":"realm_1","node":"village","on":"firstEnter","replaces":"village.1 (plays before meadow_intro)"},"background":"bg_village_morning","music":"village_theme","once":true,"slots":{"L1":{"char":"hero","expr":"happy"},"R1":{"char":"granny_bai","expr":"happy"},"R2":{"char":"xiaolong","expr":"neutral"}},"teaches":["C001","C007"],"words":["C001","C007"],"lines":[{"id":"l1","speaker":"narrator","side":"none","expr":"neutral","en":"Little Hill Village. Today is {hero}'s birthday.","vo":null},{"id":"l2","speaker":"granny_bai","side":"R1","expr":"happy","en":"Happy birthday, {hero}! I found this by the old well this morning. It's warm... and it's wiggling.","vo":null},{"id":"l3","speaker":"narrator","side":"none","expr":"neutral","en":"Crack... crack... POP! A tiny golden dragon tumbles out of the egg.","vo":null},{"id":"l4","speaker":"xiaolong","side":"R2","expr":"surprised","en":"{C001}!","tokens":["C001"],"vo":null},{"id":"l5","speaker":"hero","side":"L1","expr":"surprised","en":"It... talked?!","vo":null},{"id":"l6","speaker":"granny_bai","side":"R1","expr":"surprised","en":"A golden dragon! I haven't seen one of those since... well. Since I was young and brave and had knees that worked.","vo":null},{"id":"l7","speaker":"xiaolong","side":"R2","expr":"happy","en":"{C001}! {C001}!","tokens":["C001"],"vo":null},{"id":"l8","speaker":"granny_bai","side":"R1","expr":"thinking","en":"One word is all he knows. Words are precious, little one. Lately the creatures out in the meadow have been forgetting theirs.","vo":null},{"id":"l9","speaker":"granny_bai","side":"R1","expr":"worried","en":"A grey fog rolled over the hills. Now the rabbits are grumpy and the crows won't stop shouting.","vo":null},{"id":"l10","speaker":"hero","side":"L1","expr":"thinking","en":"What should I say to the little dragon?","vo":null,"choices":[{"id":"c1","en":"{C001}!","tokens":["C001"],"goto":"l11","correct":true,"setFlags":["r1_said_hello"]},{"id":"c2","en":"Wave and say nothing.","goto":"l12"}]},{"id":"l11","speaker":"xiaolong","side":"R2","expr":"happy","en":"(He spins in a circle and hugs your leg.)","vo":null,"goto":"l13"},{"id":"l12","speaker":"xiaolong","side":"R2","expr":"sad","en":"(He tilts his head, waiting... then hugs your leg anyway.)","vo":null},{"id":"l13","speaker":"granny_bai","side":"R1","expr":"happy","en":"When someone gives you a present, we say {C007}. Go on, try it!","tokens":["C007"],"vo":null},{"id":"l14","speaker":"hero","side":"L1","expr":"happy","en":"{C007}, Granny Bai!","tokens":["C007"],"vo":null},{"id":"l15","speaker":"granny_bai","side":"R1","expr":"happy","en":"Ha! Good manners. He looks like a Xiaolong to me. Little Dragon. Now take my old stick... and this hungry fellow.","vo":null},{"id":"l16","speaker":"xiaolong","side":"R2","expr":"happy","en":"(He chews the stick. Then he chews your sleeve.)","vo":null},{"id":"l17","speaker":"granny_bai","side":"R1","expr":"neutral","en":"Farmer Li down the road needs help. Talk kindly, answer bravely, and the fog will clear. Off you go!","vo":null,"end":true}],"onEnd":[{"setFlag":"met_xiaolong"},{"joinParty":"xiaolong"},{"setFlag":"met_granny_bai"}]}